{
  "schema_version": "0.1.0",
  "captured_at": "2026-05-28T17:21:37.234227+00:00",
  "os": "Windows-10-10.0.19044-SP0",
  "python": "3.12.10 (tags/v3.12.10:0cc8128, Apr  8 2025, 12:21:36) [MSC v.1943 64 bit (AMD64)]",
  "commands": {
    "python_executable": "H:\\dinoml_v2\\.venv\\rocm\\Scripts\\python.exe",
    "venv": "H:\\dinoml_v2\\.venv\\rocm",
    "hipcc_version": {
      "available": true,
      "stdout": "HIP version: 7.2.53211-158bd99533\nAMD clang version 22.0.0git (https://github.com/ROCm/llvm-project.git d6e2ccedeaf305be049cf7d11dbf039aa10cc5eb+PATCHED:093518e8e59892fbc4b55b6652dec090672d32ff)\nTarget: x86_64-pc-windows-msvc\nThread model: posix\nInstalledDir: H:\\dinoml_v2\\.venv\\rocm\\Lib\\site-packages\\_rocm_sdk_core\\lib\\llvm\\bin"
    },
    "rocminfo": {
      "available": false,
      "stderr": "rocminfo not found"
    },
    "rocm_smi": {
      "available": false,
      "stderr": "rocm-smi not found"
    },
    "rocprof": {
      "available": false,
      "stderr": "rocprof not found"
    },
    "rocprofv3": {
      "available": false,
      "stderr": "rocprofv3 not found"
    },
    "torch": {
      "torch_version": "2.9.1+rocm7.2.1",
      "torch_hip": "7.2.53211-158bd99533",
      "torch_cuda": null,
      "cuda_is_available": true,
      "device_count": 1
    }
  },
  "gpus": [
    {
      "device_name": "AMD Radeon RX 9070 XT",
      "gfx_target": "gfx1201",
      "source": "torch.cuda.get_device_properties(0).gcnArchName"
    }
  ]
}
